{
  "schema_version": "1.2.0",
  "release_readiness_id": "release_readiness_ws_productos_v2_runtime",
  "workspace_id": "ws_productos_v2",
  "feature_id": "feature_v3_runtime_foundation",
  "status": "ready",
  "decision_summary": "The bounded runtime release is ready because the key claims are evidence-backed and support-facing controls are explicit.",
  "launch_roles": [
    {
      "role_name": "Launch owner",
      "responsibility": "Final go or no-go decision and staged rollout coordination",
      "assignment_status": "assigned",
      "owner_name": "ProductOS PM",
      "owner_function": "Product management"
    },
    {
      "role_name": "Runtime reviewer",
      "responsibility": "Confirm cockpit, orchestration, intake, and memory behaviors are coherent",
      "assignment_status": "assigned",
      "owner_name": "ProductOS PM",
      "owner_function": "Product operations"
    },
    {
      "role_name": "Support readiness reviewer",
      "responsibility": "Confirm internal guidance for blocked routes and provenance warnings",
      "assignment_status": "assigned",
      "owner_name": "ProductOS PM",
      "owner_function": "Support operations"
    }
  ],
  "claim_readiness": [
    {
      "claim": "The runtime foundation materially reduces PM reconstruction work.",
      "status": "verified",
      "evidence_refs": [
        "pm_superpower_benchmark_ws_productos_v2_v3_0",
        "runtime_scenario_report_ws_productos_v2_v3_0"
      ]
    },
    {
      "claim": "The release remains bounded to internal PM operating value rather than broader autonomous PM claims.",
      "status": "bounded",
      "evidence_refs": [
        "release_gate_decision_ws_productos_v2_runtime"
      ]
    }
  ],
  "blocking_evidence_refs": [
    "runtime_scenario_report_ws_productos_v2_v3_0"
  ],
  "checks": [
    {
      "name": "Runtime benchmark movement",
      "status": "passed",
      "notes": "Benchmark movement is materially stronger than the V2 baseline."
    },
    {
      "name": "Runtime scenario proof",
      "status": "passed",
      "notes": "Runtime scenario coverage passed with provenance handling folded into the normal ready-state path."
    },
    {
      "name": "Trust and compliance boundary",
      "status": "passed",
      "notes": "Internal-only learning-loop artifacts remain distinct from PM-facing product claims."
    }
  ],
  "generated_at": "2026-03-21T23:30:00Z"
}
